{
  "$schema": "https://json-schema.org/draft/2020-12/schema",
  "type": "object",
  "properties": {
    "catalogKey": {
      "type": "string",
      "minLength": 1,
      "maxLength": 100,
      "pattern": "^[a-z][a-z0-9_]*$"
    },
    "revision": {
      "type": "integer",
      "exclusiveMinimum": 0,
      "maximum": 9007199254740991
    },
    "contentHash": {
      "type": "string",
      "minLength": 64,
      "maxLength": 64,
      "pattern": "^[a-f0-9]{64}$"
    },
    "mainEvent": {
      "type": "object",
      "properties": {
        "startsAt": {
          "type": "string",
          "minLength": 20,
          "maxLength": 29,
          "allOf": [
            {
              "pattern": "^(?:(?:\\d\\d[2468][048]|\\d\\d[13579][26]|\\d\\d0[48]|[02468][048]00|[13579][26]00)-02-29|\\d{4}-(?:(?:0[13578]|1[02])-(?:0[1-9]|[12]\\d|3[01])|(?:0[469]|11)-(?:0[1-9]|[12]\\d|30)|(?:02)-(?:0[1-9]|1\\d|2[0-8])))T(?:(?:[01]\\d|2[0-3]):[0-5]\\d:[0-5]\\d(?:\\.\\d+)?(?:Z|([+-](?:[01]\\d|2[0-3]):[0-5]\\d)))$"
            },
            {
              "pattern": "^(?!.*-00:00$)\\d{4}-\\d{2}-\\d{2}T\\d{2}:\\d{2}:\\d{2}(?:\\.\\d{1,3})?(?:Z|[+-]\\d{2}:\\d{2})$"
            }
          ],
          "description": "Confirmed RFC 3339 instant with seconds and Z or an explicit offset. At most three fractional digits; no floating local times. Send the event IANA time zone separately."
        },
        "timeZone": {
          "type": "string",
          "minLength": 1,
          "maxLength": 100,
          "description": "1–100 Unicode code points; surrounding whitespace is trimmed before validation."
        }
      },
      "required": [
        "startsAt",
        "timeZone"
      ],
      "additionalProperties": false
    },
    "suggestions": {
      "maxItems": 50,
      "type": "array",
      "items": {
        "oneOf": [
          {
            "type": "object",
            "properties": {
              "key": {
                "type": "string",
                "minLength": 1,
                "maxLength": 100,
                "pattern": "^[a-z][a-z0-9_]*$"
              },
              "localDateTime": {
                "type": "string",
                "minLength": 19,
                "maxLength": 19,
                "allOf": [
                  {
                    "pattern": "^(?:(?:\\d\\d[2468][048]|\\d\\d[13579][26]|\\d\\d0[48]|[02468][048]00|[13579][26]00)-02-29|\\d{4}-(?:(?:0[13578]|1[02])-(?:0[1-9]|[12]\\d|3[01])|(?:0[469]|11)-(?:0[1-9]|[12]\\d|30)|(?:02)-(?:0[1-9]|1\\d|2[0-8])))T(?:(?:[01]\\d|2[0-3]):[0-5]\\d:[0-5]\\d(?:\\.\\d+)?(?:Z)|(?:[01]\\d|2[0-3]):[0-5]\\d(?::[0-5]\\d(?:\\.\\d+)?)?)$"
                  },
                  {
                    "pattern": "^\\d{4}-\\d{2}-\\d{2}T\\d{2}:\\d{2}:\\d{2}$"
                  }
                ]
              },
              "status": {
                "type": "string",
                "const": "suggested"
              },
              "candidates": {
                "minItems": 1,
                "maxItems": 1,
                "type": "array",
                "items": {
                  "type": "string",
                  "minLength": 20,
                  "maxLength": 29,
                  "allOf": [
                    {
                      "pattern": "^(?:(?:\\d\\d[2468][048]|\\d\\d[13579][26]|\\d\\d0[48]|[02468][048]00|[13579][26]00)-02-29|\\d{4}-(?:(?:0[13578]|1[02])-(?:0[1-9]|[12]\\d|3[01])|(?:0[469]|11)-(?:0[1-9]|[12]\\d|30)|(?:02)-(?:0[1-9]|1\\d|2[0-8])))T(?:(?:[01]\\d|2[0-3]):[0-5]\\d:[0-5]\\d(?:\\.\\d+)?(?:Z|([+-](?:[01]\\d|2[0-3]):[0-5]\\d)))$"
                    },
                    {
                      "pattern": "^(?!.*-00:00$)\\d{4}-\\d{2}-\\d{2}T\\d{2}:\\d{2}:\\d{2}(?:\\.\\d{1,3})?(?:Z|[+-]\\d{2}:\\d{2})$"
                    }
                  ],
                  "description": "Confirmed RFC 3339 instant with seconds and Z or an explicit offset. At most three fractional digits; no floating local times. Send the event IANA time zone separately."
                }
              }
            },
            "required": [
              "key",
              "localDateTime",
              "status",
              "candidates"
            ],
            "additionalProperties": false
          },
          {
            "type": "object",
            "properties": {
              "key": {
                "type": "string",
                "minLength": 1,
                "maxLength": 100,
                "pattern": "^[a-z][a-z0-9_]*$"
              },
              "localDateTime": {
                "type": "string",
                "minLength": 19,
                "maxLength": 19,
                "allOf": [
                  {
                    "pattern": "^(?:(?:\\d\\d[2468][048]|\\d\\d[13579][26]|\\d\\d0[48]|[02468][048]00|[13579][26]00)-02-29|\\d{4}-(?:(?:0[13578]|1[02])-(?:0[1-9]|[12]\\d|3[01])|(?:0[469]|11)-(?:0[1-9]|[12]\\d|30)|(?:02)-(?:0[1-9]|1\\d|2[0-8])))T(?:(?:[01]\\d|2[0-3]):[0-5]\\d:[0-5]\\d(?:\\.\\d+)?(?:Z)|(?:[01]\\d|2[0-3]):[0-5]\\d(?::[0-5]\\d(?:\\.\\d+)?)?)$"
                  },
                  {
                    "pattern": "^\\d{4}-\\d{2}-\\d{2}T\\d{2}:\\d{2}:\\d{2}$"
                  }
                ]
              },
              "status": {
                "type": "string",
                "const": "ambiguous"
              },
              "candidates": {
                "minItems": 2,
                "maxItems": 2,
                "type": "array",
                "items": {
                  "type": "string",
                  "minLength": 20,
                  "maxLength": 29,
                  "allOf": [
                    {
                      "pattern": "^(?:(?:\\d\\d[2468][048]|\\d\\d[13579][26]|\\d\\d0[48]|[02468][048]00|[13579][26]00)-02-29|\\d{4}-(?:(?:0[13578]|1[02])-(?:0[1-9]|[12]\\d|3[01])|(?:0[469]|11)-(?:0[1-9]|[12]\\d|30)|(?:02)-(?:0[1-9]|1\\d|2[0-8])))T(?:(?:[01]\\d|2[0-3]):[0-5]\\d:[0-5]\\d(?:\\.\\d+)?(?:Z|([+-](?:[01]\\d|2[0-3]):[0-5]\\d)))$"
                    },
                    {
                      "pattern": "^(?!.*-00:00$)\\d{4}-\\d{2}-\\d{2}T\\d{2}:\\d{2}:\\d{2}(?:\\.\\d{1,3})?(?:Z|[+-]\\d{2}:\\d{2})$"
                    }
                  ],
                  "description": "Confirmed RFC 3339 instant with seconds and Z or an explicit offset. At most three fractional digits; no floating local times. Send the event IANA time zone separately."
                }
              }
            },
            "required": [
              "key",
              "localDateTime",
              "status",
              "candidates"
            ],
            "additionalProperties": false
          },
          {
            "type": "object",
            "properties": {
              "key": {
                "type": "string",
                "minLength": 1,
                "maxLength": 100,
                "pattern": "^[a-z][a-z0-9_]*$"
              },
              "localDateTime": {
                "type": "string",
                "minLength": 19,
                "maxLength": 19,
                "allOf": [
                  {
                    "pattern": "^(?:(?:\\d\\d[2468][048]|\\d\\d[13579][26]|\\d\\d0[48]|[02468][048]00|[13579][26]00)-02-29|\\d{4}-(?:(?:0[13578]|1[02])-(?:0[1-9]|[12]\\d|3[01])|(?:0[469]|11)-(?:0[1-9]|[12]\\d|30)|(?:02)-(?:0[1-9]|1\\d|2[0-8])))T(?:(?:[01]\\d|2[0-3]):[0-5]\\d:[0-5]\\d(?:\\.\\d+)?(?:Z)|(?:[01]\\d|2[0-3]):[0-5]\\d(?::[0-5]\\d(?:\\.\\d+)?)?)$"
                  },
                  {
                    "pattern": "^\\d{4}-\\d{2}-\\d{2}T\\d{2}:\\d{2}:\\d{2}$"
                  }
                ]
              },
              "status": {
                "type": "string",
                "const": "nonexistent"
              },
              "candidates": {
                "minItems": 0,
                "maxItems": 0,
                "type": "array",
                "items": {
                  "type": "string",
                  "minLength": 20,
                  "maxLength": 29,
                  "allOf": [
                    {
                      "pattern": "^(?:(?:\\d\\d[2468][048]|\\d\\d[13579][26]|\\d\\d0[48]|[02468][048]00|[13579][26]00)-02-29|\\d{4}-(?:(?:0[13578]|1[02])-(?:0[1-9]|[12]\\d|3[01])|(?:0[469]|11)-(?:0[1-9]|[12]\\d|30)|(?:02)-(?:0[1-9]|1\\d|2[0-8])))T(?:(?:[01]\\d|2[0-3]):[0-5]\\d:[0-5]\\d(?:\\.\\d+)?(?:Z|([+-](?:[01]\\d|2[0-3]):[0-5]\\d)))$"
                    },
                    {
                      "pattern": "^(?!.*-00:00$)\\d{4}-\\d{2}-\\d{2}T\\d{2}:\\d{2}:\\d{2}(?:\\.\\d{1,3})?(?:Z|[+-]\\d{2}:\\d{2})$"
                    }
                  ],
                  "description": "Confirmed RFC 3339 instant with seconds and Z or an explicit offset. At most three fractional digits; no floating local times. Send the event IANA time zone separately."
                }
              }
            },
            "required": [
              "key",
              "localDateTime",
              "status",
              "candidates"
            ],
            "additionalProperties": false
          },
          {
            "type": "object",
            "properties": {
              "key": {
                "type": "string",
                "minLength": 1,
                "maxLength": 100,
                "pattern": "^[a-z][a-z0-9_]*$"
              },
              "localDateTime": {
                "type": "null"
              },
              "status": {
                "type": "string",
                "const": "manual"
              },
              "candidates": {
                "minItems": 0,
                "maxItems": 0,
                "type": "array",
                "items": {
                  "type": "string",
                  "minLength": 20,
                  "maxLength": 29,
                  "allOf": [
                    {
                      "pattern": "^(?:(?:\\d\\d[2468][048]|\\d\\d[13579][26]|\\d\\d0[48]|[02468][048]00|[13579][26]00)-02-29|\\d{4}-(?:(?:0[13578]|1[02])-(?:0[1-9]|[12]\\d|3[01])|(?:0[469]|11)-(?:0[1-9]|[12]\\d|30)|(?:02)-(?:0[1-9]|1\\d|2[0-8])))T(?:(?:[01]\\d|2[0-3]):[0-5]\\d:[0-5]\\d(?:\\.\\d+)?(?:Z|([+-](?:[01]\\d|2[0-3]):[0-5]\\d)))$"
                    },
                    {
                      "pattern": "^(?!.*-00:00$)\\d{4}-\\d{2}-\\d{2}T\\d{2}:\\d{2}:\\d{2}(?:\\.\\d{1,3})?(?:Z|[+-]\\d{2}:\\d{2})$"
                    }
                  ],
                  "description": "Confirmed RFC 3339 instant with seconds and Z or an explicit offset. At most three fractional digits; no floating local times. Send the event IANA time zone separately."
                }
              }
            },
            "required": [
              "key",
              "localDateTime",
              "status",
              "candidates"
            ],
            "additionalProperties": false
          }
        ]
      }
    }
  },
  "required": [
    "catalogKey",
    "revision",
    "contentHash",
    "mainEvent",
    "suggestions"
  ],
  "additionalProperties": false,
  "$id": "https://schemas.gatherory.com/blueprint-schedule/v1.json",
  "title": "Gatherory Blueprint Schedule Suggestions v1"
}
