{
  "catalogKey": "wedding",
  "revision": 1,
  "contentHash": "24518a2d4795d62a7d0ed5d349cd0bb7ed7a2883a7dec7bf9c522a8e5119878a",
  "mainEvent": {
    "startsAt": "2027-06-15T19:00:00Z",
    "timeZone": "America/Detroit"
  },
  "suggestions": [
    {
      "key": "venue_visit",
      "status": "suggested",
      "localDateTime": "2027-05-16T12:00:00",
      "candidates": [
        "2027-05-16T16:00:00Z"
      ]
    },
    {
      "key": "rehearsal",
      "status": "suggested",
      "localDateTime": "2027-06-14T17:00:00",
      "candidates": [
        "2027-06-14T21:00:00Z"
      ]
    },
    {
      "key": "ceremony",
      "status": "suggested",
      "localDateTime": "2027-06-15T15:00:00",
      "candidates": [
        "2027-06-15T19:00:00Z"
      ]
    },
    {
      "key": "reception",
      "status": "suggested",
      "localDateTime": "2027-06-15T18:00:00",
      "candidates": [
        "2027-06-15T22:00:00Z"
      ]
    }
  ]
}
